{
  "schema": {
    "major": 1,
    "minor": 1
  },
  "generated_at": "2026-09-30T14:00:00+00:00",
  "theme": {
    "id": "th-surrealism",
    "name": "Surrealism"
  },
  "rotation": {
    "interval_seconds": 180,
    "shuffle": false
  },
  "directive": {
    "sequence": 5,
    "pinned_work_id": "w-dali-1"
  },
  "entries": [
    {
      "work_id": "w-dali-1",
      "render_path": "renders/w-dali-1/tv_display_3840x2160.jpg",
      "label": {
        "title": "The Persistence of Memory",
        "artist": "Salvador Dalí",
        "artist_family_name": "Dalí",
        "artist_given_name": "Salvador",
        "artist_nationality": "Spanish",
        "artist_dates": "1904–1989",
        "date_created": "1931",
        "medium": "Oil on canvas",
        "dimensions": "24.1 × 33 cm",
        "commentary": null
      }
    },
    {
      "work_id": "w-moche-1",
      "render_path": "renders/w-moche-1/tv_display_3840x2160.jpg",
      "label": {
        "title": "Stirrup-spout vessel",
        "artist": null,
        "artist_family_name": null,
        "artist_given_name": null,
        "artist_nationality": null,
        "artist_dates": null,
        "date_created": "100 BCE–500 CE",
        "medium": "Ceramic",
        "dimensions": null,
        "commentary": null
      }
    }
  ]
}
