{
  "schema": {
    "major": 1,
    "minor": 2
  },
  "generated_at": "2026-09-30T14:00:00+00:00",
  "theme": {
    "id": "th-surrealism",
    "name": "Surrealism"
  },
  "rotation": {
    "interval_seconds": 180,
    "shuffle": false
  },
  "directive": {
    "sequence": 4,
    "pinned_work_id": null
  },
  "entries": [
    {
      "work_id": "w-dali-1",
      "render_path": "renders/w-dali-1/tv_display_3840x2160.jpg",
      "label": {
        "title": "The Persistence of Memory",
        "artist": "Salvador Dalí",
        "artist_family_name": "Dalí",
        "artist_given_name": "Salvador",
        "artist_nationality": "Spanish",
        "artist_dates": "1904–1989",
        "date_created": "1931",
        "medium": "Oil on canvas",
        "dimensions": "24.1 × 33 cm",
        "commentary": null
      },
      "media": {
        "url": "https://library.example/media/sha256-aaaaaaaaaaaaaaaaaaaaaaaaaaaaaaaaaaaaaaaaaaaaaaaaaaaaaaaaaaaaaaaa",
        "sha256": "aaaaaaaaaaaaaaaaaaaaaaaaaaaaaaaaaaaaaaaaaaaaaaaaaaaaaaaaaaaaaaaa",
        "bytes": 2481733,
        "content_type": "image/jpeg"
      }
    }
  ]
}
